{
    "session_id":  "session-20260517-222228",
    "phase":  "plan",
    "gates":  {
                  "plan_passed":  false,
                  "review_passed":  false,
                  "qa_passed":  false,
                  "ship_ready":  false
              },
    "findings":  {
                     "critical":  0,
                     "high":  0,
                     "medium":  0,
                     "low":  0
                 },
    "selected_assets":  [

                        ],
    "updated_at":  "2026-05-17T13:49:19Z",
    "proposal_state":  {
                           "proposal_id":  "",
                           "status":  "none",
                           "mode":  "",
                           "options":  [

                                       ],
                           "recommended_option":  "",
                           "selected_option":  "",
                           "created_at":  "",
                           "updated_at":  "",
                           "last_user_reply_type":  "none"
                       }
}
